{
  "schema_version": "0.8.0",
  "generated_at": "2026-05-21T15:09:35.626Z",
  "history_dir": "/Users/nazarkoartem/Desktop/Projects/caesar-compliance/caesar-ai-scan/tmp/sample-history",
  "target_project": "/Users/nazarkoartem/Desktop/Projects/caesar-compliance/caesar-ai-scan/fixtures/sample-ai-project",
  "runs": [
    {
      "run_id": "run_2026-05-21T15-09-35-569Z_33e6",
      "generated_at": "2026-05-21T15:09:35.570Z"
    },
    {
      "run_id": "run_2026-05-21T15-09-35-626Z_bbe5",
      "generated_at": "2026-05-21T15:09:35.626Z"
    }
  ],
  "latest_run_id": "run_2026-05-21T15-09-35-626Z_bbe5",
  "run_count": 2,
  "safety_notes": [
    "This history index is strictly local and offline.",
    "Do not publish this file to public web servers."
  ]
}